{
  "schemaVersion": "1.0",
  "generatedFrom": {
    "path": "references\\design-styles.md",
    "sha256": "4caa2b6f314a707993ee2ca0304c0f89ee3cc2580493a5662d9b01cc49e5d287",
    "entries": 60
  },
  "styles": [
    {
      "id": "editorial-brutalism",
      "name": "미디어급 브루탈리즘 Editorial Brutalism（거대한 Helvetica가 작은 본문을 압도）",
      "section": "web",
      "supports": [
        "html"
      ],
      "temperature": "bold",
      "temperatureKo": "대담",
      "fidelity": 98,
      "contrast": "mixed",
      "motionLevel": "subtle",
      "audiences": [
        "미디어",
        "콘텐츠 출판",
        "AI 제품 발표",
        "브랜드 홈페이지 hero",
        "리서치 보고서 표지",
        "의견형 장문 헤더 이미지"
      ],
      "palette": [
        "#000000",
        "#FFFFFF",
        "#0000EE",
        "#FF433D",
        "#00A33E"
      ],
      "fonts": [
        "Inter",
        "Geist Mono"
      ],
      "references": "Bloomberg Businessweek（Richard Turley 2010–2014 개편，Code and Theory 담당）；Neue Haas Grotesk 계열",
      "dna": "배색=순수 검정#000+순백#FFF+링크 블루#0000EE, 신호 오렌지레드#FF433D/터미널 그린#00A33E를 포인트로 사용. 서체=Helvetica/Neue Haas Grotesk, 120px+ 대형 headline을 왼쪽 정렬·촘촘한 자간으로 14px 작은 본문 위에 강하게 배치해 극단적 크기 대비를 만든다. 레이아웃=모듈형 그리드+1px 규칙선으로 칼럼을 분할하고, 높은 정보 밀도를 위해 의도적으로 여백을 남기지 않는다. 표지 요소=규칙선 칼럼, 링크 블루 밑줄, 흑백 바탕의 큰 색 블록.",
      "html": "순수 CSS로 1:1 재현 가능. CSS Grid로 모듈형 그리드를 구성하고 border로 규칙선 칼럼을 나눈다. clamp()로 초대형 반응형 글자 크기를 만들고 letter-spacing을 좁히며, 시스템 Helvetica/Arial 스택 또는 Inter를 폴백으로 사용한다. 하이퍼링크에는 #0000EE 밑줄을 직접 적용한다. 외부 소재에 의존하지 않는다.",
      "fontNote": "Inter(Helvetica/Neue Haas Grotesk 대체), 코드에는 Geist Mono 사용",
      "source": "references/design-styles.md#editorial-brutalism"
    },
    {
      "id": "neo-brutalism",
      "name": "신 브루탈리즘 충돌색 정보 피드 Neo-Brutalism（두꺼운 검은 아웃라인 카드+고채도 충돌색）",
      "section": "web",
      "supports": [
        "html"
      ],
      "temperature": "bold",
      "temperatureKo": "대담",
      "fidelity": 95,
      "contrast": "dark",
      "motionLevel": "expressive",
      "audiences": [
        "미디어",
        "콘텐츠 사이트",
        "AI 제품 모음 페이지",
        "이벤트 landing",
        "커뮤니티 순위 페이지",
        "Xiaohongshu풍 정보 카드"
      ],
      "palette": [
        "#5200FF",
        "#E1306C",
        "#F8E000",
        "#08080D"
      ],
      "fonts": [
        "Space Grotesk"
      ],
      "references": "The Verge 2022 리디자인(in-house team, PolySans + Mānuka)",
      "dna": "배색=일렉트릭 퍼플#5200FF~마젠타#E1306C의 고채도 주색+밝은 노랑#F8E000 강조색+순수 검정#08080D+흰색. 넓은 대비 색 블록을 의도적으로 부드럽게 다루지 않는다. 서체=기하학적 산세리프 대형 제목과 세리프 본문의 대비. 레이아웃=카드형 feed 흐름, 2-4px 굵은 검정 윤곽선, 단단한 색 블록 구획, 거의 없는 둥근 모서리. 표지 요소=굵은 윤곽선 카드의 hover 대비색 반전, 미완성 인터페이스 분위기.",
      "html": "순수 CSS의 강점이 잘 드러난다. border:3px solid #000 굵은 윤곽선+box-shadow의 단단한 오프셋 그림자(4px 4px 0 #000)+grid/flex 카드 흐름+:hover에서 background를 바꿔 대비색 반전을 구현한다. 3D나 광원 효과가 필요 없다.",
      "fontNote": "Space Grotesk（PolySans 대체）+ 임의의 세리프（예: Fraunces）",
      "source": "references/design-styles.md#neo-brutalism"
    },
    {
      "id": "memphis-maximalism",
      "name": "멤피스 복고 콜라주 극대화 Memphis Maximalism（대비 색 블록+어긋나게 겹치기+복고 서체）",
      "section": "web",
      "supports": [
        "html"
      ],
      "temperature": "bold",
      "temperatureKo": "대담",
      "fidelity": 72,
      "contrast": "unknown",
      "motionLevel": "subtle",
      "audiences": [
        "전자상거래 컨셉 스토어",
        "창의적 이벤트 페이지",
        "브랜드 실험 캠페인",
        "Y2K 복고 테마",
        "명절 마케팅 페이지"
      ],
      "palette": [],
      "fonts": [
        "DM Serif Display",
        "Bungee",
        "Space Mono"
      ],
      "references": "Gucci Vault 컨셉 스토어（Alessandro Michele）；Memphis 디자인 운동 / Sagmeister의 반항적 기질",
      "dna": "배색 빈티지 레드/겨자색/로열 블루/보라/올리브 그린 대면적 충돌 색 병치+빈티지 베이지 따뜻한 배경，강렬하고 의도적으로 불협화음。서체는 복고풍 세리프+장식 서체 혼용、인쇄 질감、그리드 파괴된 어긋나게 겹쳐 놓음。레이아웃은 반그리드 콜라주 큐레이션、모듈 크기 불균형으로 뒤섞여 겹쳐짐、디지털 룸을 둘러보는 느낌。시그니처 요소：충돌 색 블록、어긋난 겹침、비정형 내비게이션 이스터 에그。",
      "html": "transform:rotate()로 어긋나게 겹쳐놓기+position:absolute로 겹침+고채도 background 충돌 색 블록+빈티지 Google Fonts。실제 빈티지 텍스처는 CSS로 재현 불가，순색 블록+mix-blend-mode/contrast 필터로 질감 시뮬레이션으로 대체，기하학 콜라주 버전은 성립하지만、archival 빈티지 버전은 저하될 것。",
      "fontNote": "DM Serif Display + Bungee（장식）+ Space Mono",
      "source": "references/design-styles.md#memphis-maximalism"
    },
    {
      "id": "friendly-geometric-candy",
      "name": "캔디 컬러 양각 입체 버튼 게임화 Friendly Geometric Candy",
      "section": "web",
      "supports": [
        "html"
      ],
      "temperature": "bold",
      "temperatureKo": "대담",
      "fidelity": 85,
      "contrast": "mixed",
      "motionLevel": "expressive",
      "audiences": [
        "교육용 언어 학습",
        "소비자용 App landing",
        "게임화 제품",
        "대중 친화 제품",
        "이벤트 신청 페이지"
      ],
      "palette": [
        "#58CC02",
        "#FFC800",
        "#1CB0F6"
      ],
      "fonts": [
        "Baloo 2",
        "Nunito"
      ],
      "references": "Duolingo（Johnson Banks + Monotype，Feather Bold 서체）；반(반대) 실리콘밸리식 극단적 미니멀리즘",
      "dna": "배색 Duo 그린#58CC02+덕 옐로우#FFC800+스카이 블루#1CB0F6 캔디 고채도+화이트 배경, 둥글고 친근함. 폰트 매우 굵은 라운드체(Feather Bold 느낌). 레이아웃 큰 라운드 코너 카드, 돌출된 3D 버튼(하단 하드 섀도우=눌리는 느낌), 마스코트 영역+진행률 말풍선. 시그니처 요소: 3px 솔리드 섀도우 입체 버튼, 클릭 시 위치 이동 애니메이션, 슈퍼 라운드 코너.",
      "html": "순수 CSS. box-shadow:0 4px 0 딱딱한 하단 그림자로 돌출 버튼 제작+:active translateY(4px) 그림자 제거로 클릭 시뮬레이션, border-radius 큰 라운드 코너, 단색 블록. 마스코트 이미지가 없을 때 CSS 기하학적 도형이나 emoji로 플레이스홀더 대체(가벼운 폴백).",
      "fontNote": "Baloo 2 / Nunito(Feather를 대체하는 매우 굵은 라운드체)",
      "source": "references/design-styles.md#friendly-geometric-candy"
    },
    {
      "id": "pure-css-art",
      "name": "순수 CSS 기하학적 일러스트+반응형 변형 이스터 에그 Pure-CSS Art",
      "section": "web",
      "supports": [
        "html"
      ],
      "temperature": "bold",
      "temperatureKo": "대담",
      "fidelity": 80,
      "contrast": "mixed",
      "motionLevel": "subtle",
      "audiences": [
        "개인 홈페이지",
        "크리에이티브 404",
        "이스터 에그 페이지",
        "브랜드 위트 랜딩 페이지",
        "기술 블로그 헤더 이미지",
        "디자이너 포트폴리오"
      ],
      "palette": [],
      "fonts": [
        "Rubik",
        "Archivo"
      ],
      "references": "Lynn Fisher(lynnandtonic.com, 순수 CSS 아트의 전설, Adobe 특별 보도)",
      "dna": "배색 2-4색 고대비 플랫 면(각 브레이크포인트마다 색상 구성 변경). 폰트 굵은 기하학적 산세리프 타이틀. 레이아웃의 핵심은 「뷰포트에 따라 변형되는 이미지」——CSS 도형 세트가 각 브레이크포인트에서 서로 다른 화면으로 재구성됨(예: 화면 너비에 따라 건물의 층수가 변함). 시그니처 요소: 순수 CSS로 그려진 기하학적 일러스트, 브레이크포인트 기반 재배치 이스터 에그, 제로 이미지.",
      "html": "순수 CSS의 기교 전장, 소스 파일이 필요 없는 것이 장점. div+border-radius/clip-path/transform/box-shadow로 기하학적 도형 중첩, @media 브레이크포인트로 도형 크기와 위치를 변경하여 변형 구현. 난이도는 기술보다는 디자인 구상에 있으며, 각 도형을 정성껏 수작업으로 만들어야 함.",
      "fontNote": "Rubik / Archivo(커스텀 폰트를 대체하는 굵은 기하학적 폰트)",
      "source": "references/design-styles.md#pure-css-art"
    },
    {
      "id": "bold-big-type-editorial",
      "name": "거대 타이포그래피 흑백 고대비 패션 에디토리얼 Bold Big-Type Editorial",
      "section": "web",
      "supports": [
        "html"
      ],
      "temperature": "bold",
      "temperatureKo": "대담",
      "fidelity": 88,
      "contrast": "mixed",
      "motionLevel": "subtle",
      "audiences": [
        "이커머스 패션",
        "포트폴리오",
        "미디어 특집",
        "브랜드 매니페스토 페이지",
        "비디오 강의 커버",
        "리서치 보고서 빅 타입 버전"
      ],
      "palette": [
        "#E8C4C0"
      ],
      "fonts": [
        "Archivo Expanded",
        "Anton",
        "Playfair Display"
      ],
      "references": "Jacquemus 공식 홈페이지 / Rik Oostenbroek / Domestika; 패션 잡지 포스터 스타일",
      "dna": "배색 미니멀 흑백+절제된 단일 포인트 컬러(누드 핑크#E8C4C0 또는 리얼 레드). 폰트 초대형 Display 산세리프/고대비 세리프, 타이틀이 전체 화면을 채움. 레이아웃 풀 너비 그리드, 거대 글자와 네거티브 스페이스의 조화, 이미지와 텍스트 1:1 분할. 시그니처 요소: 화면 점유율이 높은 거대 headline, 럭셔리한 여백, 좌우 대칭 타이포그래피.",
      "html": "순수 CSS로 완벽 재현. clamp() 거대 폰트 사이즈+CSS Grid 풀 너비 분할+대량의 padding 여백+vh 단위로 타이틀이 뷰포트를 가득 채우게 함. 이미지가 없을 때 단색 블록/텍스트 블록으로 패션 화보 플레이스홀더 대체(가벼운 폴백이지만 레이아웃은 유지됨).",
      "fontNote": "Archivo Expanded / Anton(Display) + Playfair Display(고대비 세리프)",
      "source": "references/design-styles.md#bold-big-type-editorial"
    },
    {
      "id": "cosmic-retro-futurism",
      "name": "레트로 퓨처리즘 우주 도감 Cosmic Retro-Futurism",
      "section": "web",
      "supports": [
        "html"
      ],
      "temperature": "bold",
      "temperatureKo": "대담",
      "fidelity": 75,
      "contrast": "mixed",
      "motionLevel": "expressive",
      "audiences": [
        "AI 제품 런칭 사이트",
        "테크 브랜드 매니페스토 페이지",
        "이벤트 카운트다운 페이지",
        "미래지향적 랜딩 페이지",
        "컨셉 발표회"
      ],
      "palette": [
        "#0A0A0A",
        "#F0EAD8",
        "#2B4F91"
      ],
      "fonts": [
        "Cormorant Garamond",
        "EB Garamond",
        "Space Mono"
      ],
      "references": "Perplexity Comet 브라우저 런칭 사이트(The Brand Identity: Black/Blue/Cream; 《2001 스페이스 오디세이》 분위기)",
      "dna": "배색 퓨어 블랙#0A0A0A+크림 화이트#F0EAD8+코발트 블루-피콕 블루 #2B4F91 한 방울, 빈티지 천문 도감 같은 저채도. 폰트 고대비 세리프(고전 천문 도감 느낌)+여백. 레이아웃 선으로 묘사된 궤도/포물선 SVG, 행성 도트, 크림 배경에 검은 글자, 고서 스타일 타이포그래피. 시그니처 요소: SVG 천체 궤도선, 크림+블루+블랙 3색, 레트로 세리프 대형 글자, 천문 도감 질감.",
      "html": "순수 CSS+SVG로 정적 버전의 분위기를 80% 재현. SVG path로 궤도 포물선 그리기+CSS 방사형 위치 지정으로 행성 도트 배치+3색 변수+고대비 세리프. 부족한 부분은 「우주에서 지구로 떨어지는」 전체 화면 비디오 전환(핵심 부분)——CSS scroll 패럴랙스+SVG 궤도 회전 유사 구현으로 폴백.",
      "fontNote": "Cormorant Garamond / EB Garamond (고대비 세리프) + Space Mono",
      "source": "references/design-styles.md#cosmic-retro-futurism"
    },
    {
      "id": "cinematic-sound-viz-dark",
      "name": "영화적 음파 시각화 Cinematic Sound-Viz Dark",
      "section": "web",
      "supports": [
        "html"
      ],
      "temperature": "bold",
      "temperatureKo": "대담",
      "fidelity": 72,
      "contrast": "dark",
      "motionLevel": "moderate",
      "audiences": [
        "오디오",
        "음성 AI 제품",
        "음악 기술 사이트",
        "팟캐스트 플랫폼",
        "미디어 릴리스 페이지",
        "시네마틱 브랜드 히어로 섹션"
      ],
      "palette": [
        "#000000"
      ],
      "fonts": [
        "Inter",
        "Sora"
      ],
      "references": "ElevenLabs; 영화 오프닝 타이틀 시퀀스 (Saul Bass 스타일의 미니멀 동적 효과) × 오디오 엔지니어링 인터페이스",